,comments_text,review,comments_titles,dates,comments_utility,words_number
151," So glad I bought this office chair.I spent a long time researching a suitable chair for comfort,more than anything else ,and this fits the bill A lot of the chairs featured on Amazon have shot up in price due to recent demand but this one ,with very good padding to the seat and backrest was by far the best value.It is simple to assemble and very sturdy.Just follow the instructions and you can’t t go wrong.I have bought Amazon Basic  products in the past and all have been excellent quality for the money. ",5,NA,i le 4 février 2021,0,93
152," The one exception, was the ridiculous castors with 3 brakes, so called safety feature. Only able to disengage if sat on. How on earth do you put the chair under a desk? My home office is carpeted, so this feature was a nightmare. Luckily, my old chair had the same fitting castors, so changed the 3 brake ones over. The chair itself is comfy, good quality, structurally sound and nice looking. ",5,NA,i le 10 août 2021,0,71
153," Chair arrived quickly and was very easy to assemble, but disappointed at the height, at full height the chair could do with being 2 to 3 inches higher i am a typist and my wrists are below the desk height restricting speed of typing and accuracy on the keyboard., shame really its too difficult for me to return so guess i will be sitting on a cushion which defeats the object.  I am 5 foot 4 inches tall just incase anyone similar wants to make a purchase. ",3,NA,i le 21 mars 2022,0,87
154, It's a very nice comfy elegant looking chair but two things which I don't like.....1. Unless you are sitting on the chair it is very difficult to move around. There seems to be a braking system which stops the wheels moving when there is no weight on it. This is awkward for me as I push the chair in under the table when not in use.2. I cannot adjust the back support to bring it forward to support my back. I have to use a  cushion as well. ,3,NA,i le 26 juin 2021,0,88
155, Great value chair.  Easy to assemble and adjust in use.  Casters lock when not being sat on to prevent rolling away.  Height adjustable.  Chair seat and back recline as one unit.  The amount of force /weight required to recline is adjustable.  Also chair can be easily locked in upright position.  Covering material feels nice and padding is comfortable.  No arms so it will go the desk.  Back rest supports lower and mid back.  I would buy again. ,5,NA,i le 14 novembre 2020,0,77
156, Bought the chair for working from home when we went into lock down as I couldn't spend another hour sat in bed trying to work. It was far too distracting. The chair was very easy to assemble and had held up very well co sodering I have used it 5 days a week for over a year. Comfortable to sit in and have no problems sat here for long periods of time however I tend to hunch when I sit at my desk so I get neck pain but that has nothing to do with the chair and more to do with my posture (it's a work in progress). I have also vigorously hoovered the seat and back (it has little holes in which collect random bits which are a pain to get out) but I have had no fraying of the material or tears/ rips so I would definitely buy this chair again if I needed one but this one should hold up for a long time. Very very happy with my chair. ,5,NA,i le 4 décembre 2021,0,174
157, Overall dissapointed by this purchase. The back of the chair tilts back by default without the option to tilt forward enough to provide decent back support. I wouldn't recommend this chair for people who need good back support. ,2,NA,i le 8 août 2020,0,38
158," Really pleased when it turned up. Looked great, cushions seemed thick and comfortable, was easy to assemble. First day using it was good, too. Second day onwards, not so much. Bum cushion squashed enough that the chair was (and will now always be) uncomfortable. Especially annoying that it has compressed most towards the front, so regardless of how much you tilt back in the chair (which requires effort you shouldn't have to make to sit still anyway), you feel slumped forward. So uncomfy that I went back to using a silly little plastic thing bought for pennies from Ikea, instead.p.s.  for context, I'm a lab scientist, so spend all day sitting at a bench on a pretty minimal lab stool; I'm not fussy., the chair is just bad. ",2,NA,i le 4 novembre 2020,0,128
159," Naturally, assembly is required but this is easy and the one tool needed (hex key) is suppliedThe chair is nice and sturdy with thick metal supports. The seat is very well padded and the fabric is a synthetic mesh which looks durable.Castors aren't the best gliders, but the base is sturdy ABS plastic and the whole package is sturdy and will last well at a very good price. ",5,NA,i le 20 mars 2020,0,68
160," Chair arrived and when unpacked there was a wheel missing so can’t be built. Contacted Amazon to ask for a replacement wheel to be sent but they can only offer a full replacement or £22 discount!! Asked for the full replacement and was advised I would have to take the faulty chair to a Hermes drop off point - we’re in the middle of a lockdown, I don’t own a car and the box is very large and heavy! After I explained this they advised they would send a courier to collect, disappointing that this wasn’t their first response given the current situation. Replacement chair will take at least 2 weeks to arrive. Very disappointing. Chair looked good quality and comfy, but cannot comment further until new one arrives. ",1,NA,i le 11 mai 2020,0,129
161," I had the chair approximately 4/5 weeks and 1 of the round feet fell apart! I tried to fix it but it kept splitting, Amazon sent a replacement which idols ok so far but when I tried to dismantle the original chair I noticed that the material underneath the front had split! I’m not sure how long this will last even with light use ",2,NA,i le 18 août 2021,0,64
162," Quite a hard seat, but hopefully overtime it will soften a bit. A good size seat, so would be good for the larger person too. I like to sit with my legs crossed or curled up and the seat is more than big enough for this. Took seconds to put together and the gas lift works perfectly. ",4,NA,i le 23 avril 2021,0,57
163," Easy to assemble, solid when built. Adjustments are adequate (just) - I am 6' 1"" and I have it fully extended.Niggles: The rollers don't, 3 of them are so stiff that they slide. The padding is thick but quite soft so I can still feel the base of the chair. The back is basically flat so not much lumbar support. But overall, good for the money. ",4,NA,i le 7 septembre 2020,0,66
164," I found it really easy to put together and was full of confidence about it being comfortable. Within a few minutes of using the chair i felt the need to adjust it and by the end of the afternoon had an aching back and shoulders. I can’t make it comfortable, no matter what i do.I am working on sending it back. ",1,NA,i le 20 septembre 2020,0,61
165, I found this chair very uncomfortable with with little back support. I found myself sitting on the front edge to try to reduce  pain and make myself comfortable. The chair is well made and of a good fabric but this is let down by the poor support. I am unable to recommend it . ,2,NA,i le 13 août 2020,0,54
166, I bought this chair as due to COVID I have been working from home and needed a comfortable office chair. Initially I was very pleased with the product. It was easy to put together and appeared comfortable but after several weeks I started to suffer from back pains in my lumbar spine which increased in intensity and I am now on pain killers. I don't normally suffer from back pain and unfortunately I do believe that it has been caused by the chair and it's lack of lumbar support. The chair is now sitting in our garage as I await delivery of a new chair. Lesson leant that it's worth paying that little bit more to get proper support. ,1,NA,i le 2 janvier 2021,0,119
167," Looks very strong & comfortable, but I received no instructions or any bolts, and when I tried to try another bolt from another office chair it screwed in only 1 turn then stopped all 4 the same, the back 2 bolts when you pushed bolt in just like on a spring, could not screw. ",3,NA,i le 31 janvier 2021,0,54
168," It's a high quality office chair for the money. If you're looking for an interim replacement or something reliable that doesn't cost the earth, I would recommend. I sit in it for a lot of hours per day and have had this chair a good few weeks now. Replaces a much more expensive chair and honestly, it isn't bad at all.If I had to be critical at all I'd say the seat material is a little too soft but not by much. It'll do for me for now, anyhow! ",5,NA,i le 11 février 2022,0,89
169, I was getting aches in my wrist and shoulder and the reviews for this chair seemed good. It is so easy to put together and quite sturdy. You can't lean back but I didn't need that. What would make it amazing is removable arms!! (Hint hint Amazon). Otherwise impressed with the comfort overall. ,4,NA,i le 15 juin 2020,0,53
170, Amazing for the price. Can't comment on durability yet but it seems strong and well made. The angle between seat and backrest is right for me with just the right curve in the backrest for lumbar support. The seat depth (front to back) is more than previous seats - 450mm - and provides an ideal amount of support under my knees when sitting right back. I also find the seat ideal for sitting forward using just the front edge as an occasional variation. ,5,NA,i le 16 février 2020,0,83
171," The chair came with the central leg missing, which meant that it was useless. I've been trying for two weeks to return it but Hermes won't collect it, and the local parcel drop off point won't take it because they say it's too big, even though it's within the allowed size. Half a chair isn't really much use.Edit to add the man from Hermes, after missing the first apointment, came a day late for the second, and claimed there had been a problem with his software. ",1,NA,i le 20 mars 2021,0,86
172," We've only had it for a day so not such a thorough review but will update if/when needed.14year old put chair together, no-little previous experience. Had it sorted within 30mins.It's perfect regarding sizing and comfort. Hopefully the same goes for endurance. ",5,NA,i le 23 juillet 2020,0,41
173," The chair seat lifting mechanism failed after 36 days. It was only adjusted x2. I’ve tried and tried to find out how to sort a return as it’s under warranty, but it’s impossible. Very frustrated ",1,NA,i le 29 septembre 2021,0,35
174," Despite the blurb on Amazon's site saying that it has safety rollers, the instructions make clear that they only work on ""textile floor covering"" and that you need to  replace them with ""different rollers"" on hard floors. I am going in search of those now, but I think you need glides. Good chair for the price otherwise, it's comfortable. The problem that the safety rollers seek to address causes permanent back injury if the chair ""runs away from you"" as you sit. It is wrong that the type of feet is not described fully, or alternatives provided. ",1,NA,i le 12 octobre 2021,0,97
175," Needed a decent chair for working from home. Very happy with it, certainly as comfortable as any I have ever had in a work office. Very easy to assemble and overall I have been very pleased with it. There will be better chairs out there of course but I didn't want to spend £100 plus. If you are on a budget and you need something decent, this will do the job. ",4,NA,i le 6 mars 2021,0,71
176," Castors do not roll if no load on chair so it is very difficult to use with a knee-hole desk. You have to drag it out rather than roll it. Whilst dragging it, one of the castors comes off every time & has to be clipped back into place. When finished it is difficult to shove the chair back under the desk as the castors do not roll & the chair is heavy. ",3,NA,i le 6 septembre 2020,0,73
177," I have had this chair since the end of septemeber. I am very happy with my purchase. It was easy to assemble and, everything works well as it is supposed to. The only bad thing to note, is that the foam on the chair is permanently flattened, probably due to sitting on it every single day for long periods of time since the day of purchase. However, it is still very comfortable to sit on, and supports well. ",4,NA,i le 3 novembre 2020,0,78
178," Really easy to put together.  Very comfortable, would be better if it had arm rests but the lack of arm rests makes it easier if you don't have much room.  After sitting on a foldable chair for over 8 hours a day for nearly a year this is a blessing to my bottom! ",5,NA,i le 14 janvier 2021,0,53
179," Love this chair and more so the price! I was really sceptical of how comfy and good this chair would be but I’m pleasantly surprised! Really comfy, sturdy and moves really well. Also really easy to assemble. No complaints at all! ",5,NA,i le 15 juin 2021,0,41
180," I just needed a chair for my desk without having to pay astronomical prices or suffer the alien looking game chairs.This chair is cheap, quite comfortable and pretty straightforward to assemble.Recommended. ",5,NA,i le 5 janvier 2022,0,31
181," I just wanted a basic swivel chair for use at home  with my computer.  This was very good value.  A few hiccups with the assembly,  but basically easy. Very comfortable. Would definitely recommend for ordinary home use. ",4,NA,i le 26 juillet 2020,0,37
182," Arrived quickly, and in perfect condition. does what it says looks fine. comfort is not the best, if you are needing to use this chair for 7 hours ie: office chair, don't buy it pay more for the extra comfort. ",3,NA,i le 19 novembre 2020,0,40
183," Padding is pretty rubbishFabric is rough to the touchWheel castors came broken, so the chair is unbalancedWould be fine for a child doing 30mins of homework in the evening, it's not good enough to work all day at home as I had intended for the chair. ",2,NA,i le 15 août 2020,3,46
184," A basic office chair which is very comfortable and offers good support, well padded, it offers so much comfort l use instead of my much more expensive high back chair, very easy to assemble. ",5,NA,i le 11 octobre 2020,0,34
185," Wasn't expecting an all singing all dancing chair for the price but based on the description and reviews, I was expecting something that gave back support. If sitting in the correct position for working at a computer, then the back of the chair is not even in contact with your back. The back of the chair is positioned incorrectly - there is no way it can provide back support. The foam padding is also too soft to be supportive and feels uneven.  Suspect it will compress out of shape quickly. ",1,NA,i le 11 septembre 2020,0,90
186," Bought this for occasional use at a home computer. It is really nice and comfortable, looks smart and for the price, very sturdy. You could probably use it regularly for a home office. ",5,NA,i le 12 octobre 2020,0,33
187, Chair's decent and comfortable but after about 8 months it would no longer fully extend and so the seat is too low and therefore I can no longer sit in a comfortable position at a fixed height desk. ,2,NA,i le 11 juillet 2021,0,38
188," Computer chair looks very nice. Disappointed that the seat upholstery slopes downwards towards the front, despite photo on brochure which shows seat cushion looks the same depth all the way round.  Plus the height cannot be increased from what I have set it at (this seems to be the highest setting that can be achieved) and thus a separate cushion is required for sitting upon. ",2,NA,i le 29 octobre 2021,0,65
189," I'm a uni student and I  brought this chair for my desk as it is cheaper than a lot of other desk chairs. I've had the chair for a year and it was so easy to assemble, sturdy too and so far I've had no problems with it. Looks a lot more expensive than it is really. Would definitely recommend to other students ",5,NA,i le 17 juillet 2020,0,63
190, Just what I wanted.  I'm not DIY knowledgeable but the instructions were easy to follow.  I just wish the infor about lowering the seat had been provided with the product but it was available online so wasn't a disaster!  I might just buy another! ,5,NA,i le 2 octobre 2020,0,44
191," It really seemed like good value for money . Unfortunate mine arrived with missing parts which indicates it was a possibly a previously returned order - this is fine however clearly no one checked before sending to me for completeness of all the parts. I needed the chair urgently so this was a big inconvenience for me . However like I said it did seem decent, I would’ve kept it otherwise so giving it stars. ",3,NA,i le 19 mai 2020,0,75
192, loved the easy assembly and the good instructions a little bit overpriced but it is a good chair we will see how it wears overall good purchase ,5,NA,i le 1 novembre 2021,0,27
193, I was very disappointed with this chair. Had I not assembled it I would have returned it.The biggest problem was the threaded inserts in the chair seat. I had three bolts that would not screw into the inserts due to faulty threads and to make matters worse the inserts then became loose and rotated in the wood base. To be fair had it not been for this the assembly would have been relatively simple. ,1,NA,i le 23 août 2020,0,74
194," Bought for my daughter who has set up a study in her bedroom until she can return to Uni.  It was delivered quickly, easy to assemble and comfy. ",5,NA,i le 20 février 2021,0,28
195," For the price, this is a very good chair. Very comfortable and easy to assemble, and does not give you backache.  Arrived well packed and in promised time. ",5,NA,i le 10 juillet 2020,0,28
196," After a week the padding on right corner  of seat went totally flat, and no I am not overweight..  now need to use a cushion on seat.. ",4,NA,i le 23 décembre 2020,0,27
197, I have used many office chairs and sometimes siting at my desk all day. I can’t understand so many good reviews. What can I say but very disappointing. One hour in this chair is enough for me! ,1,NA,i le 8 mars 2022,0,37
198," I brought this chair for my wife as her sowing chair, she loves it. It is well made, easy to put together and is comfortable. ",5,NA,i le 13 janvier 2021,0,25
199, This chair was so very easy to assemble. It is very comfy! Great chair at a great price. Was due for delivery around 23/05/2020 - arrived 08/05/2020. Very happy with my purchase. ,5,NA,i le 10 mai 2020,0,32
200, Hi.a good chair for the money padding in seet could be better but ok.well made easy to assemble .upholstery looks good. ,5,NA,i le 6 janvier 2021,0,21
201," Very reasonable priced for a good quality office chair. Well made easy to put together, and comfortable to sit in. A good purchase in my opinion. ",5,NA,i le 24 avril 2020,0,26
202," A pretty basic chair, but perfectly fine and a reasonable price. Easy to assemble and feels strong once built. ",4,NA,i le 25 août 2020,0,19
203, A good chair for the price. A bit of padding so makes it pretty comfortable to sit on for long periods of time. ,5,NA,i le 13 février 2021,0,23
204, For a cheap small chair this fits the bill but there is nothing ergonomic about this chair and I realise that I need arms to provide complete support. Also the wheels don’t roll easily on carpet ,3,NA,i le 20 février 2021,0,36
205," Very impressed with this chair. Bought due to working from home. My back pain has stopped, seems to be supporting me well. Good purchase ",5,NA,i le 14 mai 2020,0,24
206," On the downside, the chair has a tendency to go down by itself when you sit on it, no I am not overweight. ",3,NA,i le 14 septembre 2020,0,23
207, Lasted for 4 months before the base cracked around the gas strut which now poked on to the floor and cut into the carpet. Refund requested and cannot recommend. ,1,NA,i le 20 avril 2022,0,29
208, Good value for money easy to assemble . Comfortable ,4,NA,i le 29 juillet 2018,3,9
209, This chair is perfect for working from home. Easy to assemble (I did it on my own) really comfortable and sturdy. A great buy ,5,NA,i le 30 mai 2020,0,24
210, Was easy to assemble once I’d found all the parts ... I piece had slipped down in the folds of the box !!! ,5,NA,i le 28 août 2020,0,23
211, After struggling to decide which new chair to go for I finally chose this no frills one and am very glad I did! Very easy to put together and is perfectly comfortable and sturdy. I've only spent one working day in it so can't comment on its long term durability but first impressions are you can't go wrong with this. ,5,NA,i le 24 août 2020,0,60
212," Super easy to assemble, comfortable and supportive - really happy with this. Great for my home office ",5,NA,i le 3 mai 2022,0,17
213, Easy to assemble. Classic chair. Extremely comfortable. Top quality. Great value for the money. ,5,NA,i le 25 janvier 2021,0,14
214," I wanted a chair that would be comfortable and adjustable, that I could use to sit at my sewing machine.  This is perfect.  Straightforward to assemble, feels sturdy and is comfortable to sit and machine or hand sew. ",5,NA,i le 26 avril 2019,0,38
215," Absolutely brilliant. I bought this chair to set up a home office urgently for Covid-19 lock down. It's great. Very sturdy, padded and comfortable. Well worth the money. ",5,NA,i le 24 avril 2020,0,28
216," It has a weird back shape so it's difficult to lean back on, the lever also broke after around a year ",1,NA,i le 21 avril 2022,0,21
217," Not bad at all for the price. Comfortable and a good size for my box room office. I’m spending at least 8hrs a day using it, and provides sufficient support ",4,NA,i le 19 novembre 2020,0,30
218," After a few months the seat doesn't stay fixed, you lean forward and the chair seat leans forward with you. ",1,NA,i le 11 mars 2022,0,20
219," The chair was well priced and is very comfortable to sit in, really nice chair. ",5,NA,i le 14 février 2021,0,15
220," Excellent chair -right height, support and no problem to put together. ",5,NA,i le 9 mars 2021,0,11
221, Very comfy and well cushioned. Good back support and easy to assemble ,5,NA,i le 11 mars 2021,0,12
222," Nothing basic about it, easy to put together, very comfortable, good value. ",5,NA,i le 5 novembre 2020,0,12
223," Having built the chair the back is not straight,  It leans slightly over because the holes are not correctly placed. Disappointed as chair is very comfortable. ",2,NA,i le 13 août 2020,2,26
224, I was really happy with this chair. I am still working from home and using a kitchen chair was not comfy at all. This has been great as it’s so comfortable and was easy to assemble ,5,NA,i le 8 août 2020,0,36
225," Very pleased with this chair, great quality and great price, I recommend it ",5,NA,i le 17 septembre 2020,0,13
226, Good office chair- would have liked a tilt facility on the seat ,4,NA,i le 8 janvier 2021,0,12
227," I got this chair as a replacement for my old one. The standard height is amazing and it's so soft and comfortable.Perfect for studying at your own desk all day. It's even a cheaper alternative to gaming chairs.It's also fairly easy to assemble as it also comes with instructions.Overall, very happy with it, would buy again and would highly recommend~ ",5,NA,i le 2 mai 2019,0,60
228," It's serviceable as a swivel chair and is inexpensive, but the caps on the wheels are not securely fixed and pop off from time to time as you move the chair around. This appears to be the result of the strange 'safety locking' design feature (design error, I should say) described in the manual. ",3,NA,i le 11 août 2020,0,54
229, No issues. Got what I paid for.Chair used for Home Office workstation ,4,NA,i le 4 janvier 2021,0,12
230, Excellent chair and certainly takes the larger persons weight ,5,NA,i le 11 mars 2022,0,9
231," Good quality chair, very sturdy. I just wish I could adjust the tilt of the back as I feel like it leans back slightly. ",4,NA,i le 5 avril 2020,0,24
232, Being able to place back and height position. Marvellous chair for use at machine sewing. ,5,NA,i le 10 septembre 2020,0,15
233, Easy to assemble very comfortable great chair ,5,NA,i le 2 février 2021,0,7
234, Really comfy and sturdy. Amazing value for money and seems of good quality. ,5,NA,i le 18 novembre 2020,0,13
235, Very comfortable. Nice chair. Recommended. ,5,NA,i le 8 avril 2021,0,5
236, I am very pleased with this chair it is very comfortable and sturdy.  Good value money I would recommend  it. ,5,NA,i le 22 novembre 2019,0,20
237, Cannot adjust the height of the back rest so it’s not particularly comfortable after a few weeks use as you slip forward in the chair and it doesn’t support your legs/ back. I bought mine out of necessity and availability but will be looking for a better one. ,3,NA,i le 7 janvier 2021,0,48
238, Good quality and does not take up too much room in our little office. ,5,NA,i le 1 août 2018,2,14
239," Kind of comfy, the fabric is slightly slippy so not great purchase to sit on, but get what you pay for, the three stars are just so you don’t get too excited, great for the money but if your in this chair all day definitely invest in a better one ",3,NA,i le 19 février 2019,0,50
240," This chair is amazing value, you'd pay double the price Amazon charges were you to buy it elsewhere ",5,NA,i le 19 novembre 2019,0,18
241, A very comfortable chair at a great price ,4,NA,i le 18 juin 2021,0,8
242, It’s the best desk chair I’ve bought. Comfy and very well padded. ,5,NA,i le 26 avril 2020,0,12
243," Quick and easy to assemble. Strong, sturdy and comfortable. ",5,NA,i le 9 novembre 2020,0,9
244, This chair is fine for the money. ,4,NA,i le 12 février 2022,0,7
245, Lovely size and comfortable chair ,5,NA,i le 7 octobre 2020,0,5
