,comments_text,review,comments_titles,dates,comments_utility,words_number
74, L’ai acheté suite à une chute avec plâtre pour me déplacer chez moi.Il ne roule pas bien et part en crabe.L’assise est confortable et bien rembourrée.Tout dépend de votre utilisation… ,3, Confortable ,23 mai 2022,0,30
75, service impeccable merçi ,5, chaise fauteuil de bureau ,7 octobre 2019,0,3
76, La chaise semble être bien construite. Elle est confortable et faite de bons matériaux. Le passage du temps révélera si le levage à gaz peut durer - ce qui est le point faible de tous ces produits. ,4, Solide et efficace ,18 août 2017,0,37
77, Parfait ,5, Parfait ,3 mars 2022,0,1
78," Semble pas trop mal, il faut voir dans le temps si la mousse est solide. Montage facile. Par contre les roulettes roulent pas ou mal (très bas de gamme), j'ai du les changer tout de suite, pensez y ! ",4, Pas mal mais ... ,18 mars 2022,0,39
79, chaise de bureau peu imposante mais suffisament confortable ,5, esthetique agreable ,5 mai 2019,0,8
80, Super fauteuil de bureau !! Moi qui ai été opérée d une hernie discale très bon confort pour le dos je recommande !! ,5, Confortable pour le dos ,9 janvier 2020,0,23
81, Tres bien facile à monté tres confortableBien emballéContente de mon achat ,5, Fauteuil ,2 mai 2020,0,11
82," Ce que je préfère, c'est de pouvoir choisir un produit sans bouger de chez moi.On voit bien tous les détails du fauteuil, on ne peut pas se tromper. ",4, Très bon rapport qualité/prix! ,12 juin 2019,0,28
83," Le montage est relativement simple, cela semble robuste, mais cela manque de souplesse au niveau du confort .Dommage! ",3, Fauteuil pas très confortable en finalité! ,6 février 2020,0,18
84, parfait pour travailler sur mon ordinateur ,5, facile à monter - tres confortable ,16 juin 2021,0,6
85, c'est ok ,5, bonne livraison ,14 juin 2019,0,2
86," Elle n'est pas chère, elle est facile à monter même pour un néophyte et elle est confortable. Que demander de plus ? ",4, Confortable et économique ,14 août 2017,0,22
87," Produit très bien conçu, facile à monter. Semble très solide et résistant. Je ne suis pas déçu de mon choix. ",4, Très bon rapport qualité/ prix. ,16 avril 2019,0,20
88," Très confortable mais les coutures d'assise et dossier ne sont pas alignées et une étiquette blanche se trouve au niveau de l'assise, sous le tissus alvéolé ..... se voit donc par transparence....Manque de rigueur qualité !!!! Dommage !!!! ",3, Mal fait ,4 février 2021,0,38
89, BonjourTrès fácile pour monte mais lá calité ne cirrespond pas a le prix.Le reste je peux Dire qui je suis satisfect ,4, Calite-prix ,15 janvier 2021,0,21
90, à part le fait qu'il manque des accoudoirs cette chaise est nickel. Moi qui cherchais une chaise confortable pour pas trop cher je suis ravie. Je recommande ,4, Génial pour le prix ,30 mai 2019,0,27
91, Bureau ,5, C est le 2ème que je commande. Mais malheureusement cette fois-ci il est arrivé avec le pied éraflé ,8 novembre 2021,0,1
92," Confortable, rien à dire ",4, Confortable ,2 juin 2019,0,4
93, Excellent produit et confortable. ,5, Je recommande ! ,1 octobre 2019,0,4
94, Je recommande  cet  article  il  m'a  l'air  de très  bonne qualité très  facile à  monter et très  confortable ,5, super ,15 novembre 2021,0,18
95," Rien a dire sur le confort et la facilité du montage ,je le recommande a tous ceux qui recherchent  une chaise de ce genre . ",5, le confort ,18 août 2020,0,25
96," siege très confortable, facioe à monter, robuste ",5, excellent produit ,5 septembre 2019,0,7
97, Tres bon rapport qualité -prix a voir a l'usage pour la solidité ,5, siege basique assez confortable ,10 décembre 2019,0,12
98, Très jolie chaise. Confortable et très facile à monter. Je suis ravie. ,5, Très confortable. ,18 décembre 2019,0,12
99," facile a monter, pour l instant rien à dire, parfait ",4, chaise de bureau ,8 avril 2019,0,10
100, L'assise est inclinée vers l'avant : à rectifier. ,4, Déçue ,15 janvier 2020,0,8
101, Ma fille adore . ,4, Top je recommande ,22 septembre 2019,0,4
102, bien ,4, correct ,11 février 2019,0,1
103," Bonjour, colis ouvert hier soir donc le 13 novembre 2020 reçu le matin.Pas de visserie à l'intérieur.Très énervant.CordialementManuella Blanchard ",1, Manque la visserie pour monter mon siège. ,14 novembre 2020,0,19
104, Excellent rapport qualité /prix. Facile à monterJe recommande ,5, Rapport qualite/prix ,25 janvier 2021,0,8
105, J ai bien reçu ma chaise de bureaux aujourd'hui. Et mais lysole. ,5, Facile à monter ,3 août 2021,0,12
106, Roule très mal sur parquet classique ,3, Roule très mal ,17 novembre 2021,0,6
107, Parfait pour une bonne assise je le recommande ,5, exellent ,4 avril 2019,0,8
108, J’avais besoin d’une chaise de bureau et elle est très bien ,5, Son confort ,5 octobre 2019,0,11
109, Hélas un coup de cuter sur le côté du dossier. ,5, Hélas un coup de chuter sur le côté du dossier ,23 août 2020,0,10
110, Très bienConforme à ce que j'attendais ,5," Chaise,fauteuil de bureau très confortable ",21 septembre 2019,0,6
111," Top, très confortable ",5, Top ,6 juin 2020,0,3
112, pour mon bureau ,5, confort ,11 mai 2019,0,3
113, Parfait ,5, Chaise de bureau ,24 février 2021,0,1
114, Bien aimé ,4, Bien aimé ,25 septembre 2019,0,2
115," l'assise est bien moelleuse et très confortable.le dossier est relativement haut (il remonte presque jusqu'aux épaules) et très confortable aussi.Le tissu est garanti résister aux brûlures de type cigarette, ce que je n'ai pas testé. Mais il est vrai qu'il a l'air résistant.la chaise tourne et roule bien, même sur la moquette.les réglages et le montages sont faciles ; l'outil est fourni (clé 6 pans) et il y a 2 vis supplémentaires en cas de perte.Je suis très satisfaite de cette chaise robuste et très confortable. ",5, très confortable ,18 février 2017,5,86
116," Le montage de ce fauteuil de bureau est très facile à réaliser même si pour certaines étapes, il vaut mieux être deux.Les explications fournies sont explicites.Côté confort, ce fauteuil est vraiment agréable et compte tenu du prix par rapport à ce qui se trouve sur le marché, nous avons un bon rapport qualité prix. Il est réglable en hauteur avec un dossier inclinable.Esthétiquement, c'est classique. Bon produit à conseiller. ",4, Robuste et confortable ,15 février 2017,4,69
117," Bonne surprise à l'arrivée de cette chaise.Bien emballée, facile à monter. Pas besoin de notice.Le tissu est agréable, d'un beau noir, et est sensé résister aux brûlures de cigarettes.Moelleux à souhait. Pas de coins saillants pour abîmer les meubles.Le dossier bas est finalement bien adapté.Il est possible de régler la dureté de l'inclinaison mais il n'y a qu'une seule position verrouillable, seule critique que je puisse faire.Bref un bon produit pour le moment. ",5, Un beau produit ,21 mars 2017,2,73
118," Pour le prix, ce fauteuil de bureau Amazonbasics est tout à fait correct. Je suis bien assis et la construction a l'air assez robuste. Comme toujours pour ce type d'article, on verra dans le temps comment ça vielli... ",4, Bon fauteuil de bureau ,23 septembre 2019,0,38
119," Une chaise de bureau plutôt basique mais confortable, le revêtement est confortable et agréable.Le montage est facile et le guide bien expliqué.Les réglages sont multiples pour trouver la position idéale, de plus en couleur noir ça passe de partout. ",4, basique mais efficace ,9 février 2017,4,39
120, Absence de blocage des roulettes ce qui est un peu gênant sur sol lisse ou carrelé.Autrement RAS suis très satisfait. ,5, Roulettes ,20 août 2019,0,20
121, TRES SATISFAITE. ,5, Bonne assise ,16 janvier 2020,0,2
122," Pas grand chose à dire.Le montage se fait facilement, et rapidement. 2 vis sont fournies en supplément.Peu de réglages, mais les essentiels y sont (hauteur et inclinaison). Les rembourrages sont confortables. Les tissus semblent solides et résistants.La finition est correcte et la chaise est classique. ",5, Simple mais efficace et confortable ,11 mars 2017,3,45
123," J’ai acheté ce fauteuil d’abord pour préserver mon dos lors de ma journée hebdomadaire de télétravail, depuis la maison. Réception rapide, montage simple, l’assise est très correcte pour le prix, la qualité est là, le dos est bien maintenu même s’il faut se mettre bien au fond de l’assise ce n’est pas gênant. Ayant un sol mou (vynile) j’ai quand même changé les roues d’origine de diamètre 11mm par des roues un peu plus adaptées pour ne pas rayer le sol (trouvées sur Amazon aussi). J’apprécie aussi cette chaise lorsque j’ai des tâches administratives à faire à la maison le week end, le temps passé assise n’est plus synonyme de douleurs. Un super rapport qualité prix ! En plus elle n’est pas très encombrante, rangée sous un bureau type Ikea petit modèle, c’est très bien. ",5, Très bon rapport qualité prix ! Merci pour le dos ,10 mai 2019,0,135
124," Pour le bureau, très facile à monter, très confortable ",5," très confortable, facile à monter ",21 mai 2021,0,9
125, Facile à monter simple et pratique d'usage je suis satisfaite de cet article et le recommande. ,5, Bon rapport qualité prix rien à redire ,1 décembre 2020,0,16
126, Très pratique. A voir dans le temps pour la solidité.... Semble robuste. ,5, Produit conforme. ,1 avril 2022,0,12
127, solide et prix tres correct ,5, super ,11 juin 2019,0,5
128, Très confortable ,5, Assise très confortable ,10 novembre 2020,0,2
129," Ce fauteuil est facile à monter, sobre de présentation, plutôt très confortable, et d'un excellent rapport qualité/prix.Livraison très rapide en prime, dans un emballage très sérieux.Bref: bien sous tous rapports. J'eusses aimé un réglage de l'inclinaison du dossier, quitte à y mettre 10€ de plus...[1 an 1/2 plus tard] On a tendance à glisser vers l'avant, le tissu manquant de grip, mais avec un coussin prévu pour  un siège auto (±22€), le problème est réglé, et le fauteuil n'en est que plus confortable ! Ceci a résolu  mon cas à posteriori, reste à savoir si un autre fauteuil 20€ plus cher ne serait  pas parfait d'entée... ? L'idéal est d'essayer en magasin quand c'est possible  ;-D ",5, Excellent produit. ,21 novembre 2019,0,116
130," Belle chaises , à voir dans le temps,  correspond au descriptif. ",5, Bonne chaises de bureau ,11 décembre 2021,0,11
131," Lockdown prompted me to get a more suitable chair for working at the desk.  I spent hours looking and almost every chair had mixed reviews about how difficult it was to assemble, misalignment of holes and poor component quality leading to failures.  As the chair only arrived today it's too soon to commnet on reliability, but from what i've seen of the chair putting it together it should be fine.The chair arrived four days early, was very easy to put together - only eight bolts supplied with an allen key, all done in 15 mins - all of the parts were easily identifed, the instructions were clear and the chair works, it's not too big, has a good height range and seems comfortable.  Also noticed that also on Amazon you can get a replacement gas strut and base plate for twenty quid, so even if they need replacing in a couple of years it won't be the end of the world.For £55.99 including delivery it's really good value, so far so good and very happy with the choice.  So if you're looking for a basic chair look no further than this one. ",5,NA,i le 17 avril 2020,38,192
132," I bought this for working from home during lockdown. It was a rush purchase, as chairs were low in stock everywhere, and I needed to replace a really uncomfortable existing chair. This Amazon basic was delivered very quickly, so no issue with Amazon's exemplary speed of delivery.However, after having used it for 5 months pretty much 10 hours a day every weekday, I'm passing it on to a relative who will only need it for occassional use. I found that the seat compressed and became very uncomfortable and hard (and I'm not particularly heavy) so I had to get a cushion for it. Additionally, there is no back support at all. Just replaced the Amazon chair with a more expensive ""proper"" office one, and the difference is amazing, especially re back support.So I would say this chair is fine for occassional use, but if you need something decent for working from home longer term, look elsewhere. ",3,NA,i le 10 septembre 2020,28,156
133," It's quite a basic chair, but it's really strong. I weigh about 260lbs, which is above the weight rating for the chair and it's fine. I also tend to sit in funny positions, like with one foot under me, so that adds to the stress on the chair. ",5,NA,i le 25 mars 2019,24,48
134," I never normally write reviews on Amazon, but felt I needed to write a review of how good this chair is.  I ordered this chair for student accommodation.  It arrived with detailed step by step instructions, as I was going to assemble this myself.  The instructions were so easy, even a beginner like me could follow them.  The parts are clearly labelled and include everything you need.  It probably took 10 minutes in total to assemble.The chair is good quality, comfy and for the price, I think it is good value for money.  I would buy more if needed. ",5,NA,i le 17 septembre 2019,20,99
135," I bought this chair purely because I thought it would be a reasonable quality and good value for money as it was Amazon branded.Firstly, the chair is sturdily made and was very easy to assemble.However, the first thing I discovered is that it is fitted with castors that will not allow the chair to roll unless you are sitting on it. I have worked in various offices for 35 years and I have never come across an office chair that cannot be moved unless you are sitting on it, so I have absolutely no idea why this is a feature that anyone would want. I am not sure if it is supposed to be a safety feature, but in all my time working in offices I have never heard of an accident that happened because a chair moved when nobody was sitting on it.It is an inconvenient feature, as when you have finished sitting on a chair you want to push it under your desk. If you try that with this chair, it will not roll and you have to slide it across the floor. Then when you want to sit at your desk again you have to drag the chair back from the desk. It is absolutely ridiculous, and will not roll on either carpet or hard flooring. It felt like it was going to damage my flooring. 3 of the 5 castors had this strange pressure locking feature.Luckily for me, I looked at the castors on my old chair and found them to be exactly the same, minus the pressure locking feature. So I took the castors off my old chair and put them on the new one. That solved the problem.All was then well and although you cannot adjust the backrest angle on this chair, I have found the backrest aspect of it to be extremely comfortable. I have used it for working from home for 5 days for about 8 hours a day with absolutely no back pain whatsoever. In that respect, it is one of the best office chairs I have ever used in that it supports my back perfectly with no pain induced from long periods sitting.However, the real problem is that there is only a very thin layer of padding on the front of the seat of the chair. It felt ok for the first 3 or 4 days but then the padding seems to have compressed down and my thighs are resting on what feel like hard plastic, with hardly any padding. (I weigh 13 stone and am 5ft 8ins). The pain is mid way up my thighs.Today, on the 5th day of using the chair, I have had to get  a cushion from the living room and I am sitting on that, purely to ease the pain on my thighs.  I have never experienced pain in my thighs from any office chair I have ever used before.To sum up, a good try from Amazon but it is totally unacceptable to have a chair which has so little padding in a crucial area. I can't sit on it all day with the pain in my thighs, so will be replacing it with a more expensive chair. It really is true that you get what you pay for, and you can get a much more comfortable chair for £125 or so.My wife uses this chair for maybe an hour at a time once a week and she finds it comfortable. She is about 9 stone and is 5ft 3ins.  So you might find it ok if you are a bit lighter than me and don't intend to use the chair for working all day. ",1,NA,i le 28 janvier 2021,7,611
136, There is nothing basic about the Amazon Basic Office Chair - it's a fantastic typist chair - am using it as I type!  it was so easy to assemble - really happy with the chair - beautifully padded back and seat - would certainly recommend it to anyone in the market for this type of product.. ,5,NA,i le 3 janvier 2019,18,56
137," I purchased this chair as part of my home working set-up. When lockdown began I was using a dining room chair which was not fit for purpose & caused me a lot of discomfort. If you are looking for a  comfortable chair at a reasonable price, then look no further! The backrest is supportive & there is plenty of padding. You can also adjust the height to fit with your desk. The wheels dont move so great on my carpet but I expected that. If it became a problem I am sure some sort of mat under the chair would help. The assembly instructions are clear & easy to follow. I am not the best at building furniture but this took me about 15 minutes if that. The chair feels very sturdy & well made. I am  very please with it. ",5,NA,i le 16 août 2020,4,141
138, Good quality sturdy chair with thick padded seat and back.  Easy to assemble.  There appears to be two variants of the wheel casters supplied and all except one wheel caster as specified does not turn easily when moving chair so will purchase after market replacement. ,2,NA,i le 12 août 2019,9,45
139," The padding would do if you weigh less than 75kg. Don't buy this chair if you weigh more than that.2 of the wheels have a locking mechanism when you are not sitting on in. Basically this mechanism doesn't work well, and whether you are sitting or not this chair will destroy your carpets.It's just not worth the money. I'd say the chair was worth £20 maximum. ",2,NA,i le 29 juillet 2020,8,66
140," Después de casi 2 meses de uso, es sin discusiones una silla para no comprar y mirar otras alternativas. La espuma acaba chafada y deja de ser cómoda y no estoy gordo pero sí que paso entre 4-7 horas sentado cada día. La base de la barra al asiento poco a poco se he vuelto más inestable y ahora sé tambalea ligeramente a los lados indistintamente. Las ruedas jamás tuvieron intención de girar realmente para desplazarse en el mundo físico. El respaldo solo puede calificarse de poco efectivo. Arrepentido de haberla adquirido. Pronto estará en la calle, al lado de los contenedores de basura. ",2,NA, 14 juillet 2020,31,104
141," Updated: it was returned  due to bad foam that squashed flat and does not bounce back, barely tilts back and you feel like you are sliding out of the chair constantly.I wouldn't say it's a comfortable chair. Feels like real cheap foam and you can hear it squash when you sit on it. ",1,NA,i le 25 juillet 2019,10,53
142," I was pleasantly surprised by the Amazon Basics Office Chair (£53), exceeding my expectations in comfort and build quality. As always Amazon delivered my chair on time, it took 10 minutes to unwrap and assemble the chair, popping  in five wheels and tighten eight bolts!The chair has the feeling it will take plenty of punishment and keep going. Nice thick padding on the seat and back, with just the right amount of give to feel comfortable. My main concern buying an office chair to use at home was that I would end up sitting on a pile of cushions, as most chairs I've tried lack enough padding on the seat, but not here.There's a decent amount of vertical adjustment to suit most peoples needs, just check the description for details. Pulling the height adjustment handle allows you to tilt back in the chair, which is a nice touch and helps keep you feeling comfortable.I've only been using it for one day so if anything changes my opinion I will update my review. From my experience I can recommend this chair. Buy with confidence. ",5,NA,i le 7 décembre 2020,3,183
143," Having had this chair for a little while now, I'm afraid I should have heeded the warnings of those people who say it's uncomfortable for your back and/or tilts to the front.I'm not sure exactly why, I think probably the foam in the seat is probably too low quality, and compresses at the front, meaning your legs aren't supported enough, leaving you feeling like you're fractionally tipping forward and started to make my back hurt (probably compensating for this). I ended up spending more trying to get comfortable (footrest and back support - footrest helped more). They probably just need to use better quality foam in the base of the chair (particularly/more at the front).What I wrote in the review originally:- it took me about 5 minutes to build it (well 10 but would have been 5 if my toddler wasn't ""helping"")- was very simple to build (only thing I wasn't sure of was which bolts to use for a moment - then I spotted the table showing the size difference between the two types of bolts and it was obvious then)- quality of the chair is as good (or better) than I hoped for at this price. Not wobbly, material feels nice, decent shape that feels pretty comfortable to me for an chair to be working from (not relaxing back on)Unless it falls apart or wears out particularly quickly in the future I'd recommend it to anyone looking for a cheap chair to work from at a desk. ",5,NA,i le 9 janvier 2021,0,249
144," This is a simple, easy to assemble, and comfortable chair.  However it has locking castors - designed to lock the wheels when you are not sitting on the chair.  Why, I don't know, because as far as I know, most floors are level and a chair won't roll on a level floor even without locking castors...  However, it means the chair won't roll on carpet even if you're sitting on it!  To push the chair backwards, I push down with my feet and push back.  This takes enough weight off the castors that they lock!  I will be buying some replacement castors, so not such good value. ",3,NA,i le 30 septembre 2020,0,107
145, I've had this chair a week. Initial I was really impressed. It was easy to assemble and that's a big bonus. I'm not sitting on it all day and don't weigh a lot but within a couple of days the foam was already starting to compress (and it doesn't bounce back). A week on it's nicely moulded to the shape of my bum and legs but I'm concerned that it's going to get uncomfortable in a few weeks time. Also some of the stitching on the seat has started to come undone and I've had to repair it. That said it's a comfortable chair at the moment and I don't get any of the back problems I had with my last chair. Fingers crossed there won't be any further problems as I can't afford another chair! ,3,NA,i le 20 janvier 2021,0,136
146," I was really impressed with this chair when it arrived. It was well packaged, it went together easily and was really really comfy. BUT there are bad points, the first immediate issue, it smelt really badly and made my eyes itch for a good week or two so I worry what I was breathing in. The second major issue, after 4 to 5 months of daily use (I’m an average weight of 85kg) the cushioning had gone so flat I was sat on the wooden base getting back ache - it was worse than the 6 year old chair I had replaced. In fairness Amazon have replaced it and promised me it won’t happen again... I don’t see how that is possible as the replacement appears identical. Time will tell. You have been warned! ",1,NA,i le 31 octobre 2020,0,134
147, Beautiful comfortable chair but could have adjustments for the back so that it can be upright to avoid back ache.  Slightly tilting back and not perfect for typing on computers for eight hours. ,5,NA,i le 11 décembre 2018,6,33
148," First, it arrives in a box that says “ping pong ting tong industries, Shenzhen” which should be a giveaway of the quality of the product.Not a good chair. I expect an office chair to be suitable for sitting on for 8 hours at a time. But this clearly isn’t. No support for the small of your back, and forces you to lean forward.The foam isn’t as bad as others claim, it seems relatively strong foam actually.Another issue is the inability to adjust it- apart from up/down.And also you keep slipping off because the outer fabric is slippy and likes to move.If you’re tall or have back issues, avoid this chair completely. ",2,NA,i le 4 octobre 2020,0,111
149, Having to work from home so was desperate for a new chair. This took 15 minutes to put together and I find it very comfortable.  I have it in a small room and have not noticed a chemical smell from the material unlike some other reviewers. It is very comfortable so far and easy to adjust. Great value for an office chair for home use. Excellent value. ,5,NA,i le 17 novembre 2020,0,67
150," This chair was quite easy to assemble, taking me a fairly leisurely 20 minutes. It feels quite sturdy and robust in use, although the seat is a little on the hard side as other reviews have mentioned. If you only expect to need it for a year or so while working from home it should be a good choice, but for long-term use you may want to spend more on a high quality item. I'm unsure if the wheels would be safe to use on laminate flooring so it may be prudent to sit it on a rug of some sort in this instance. ",4,NA,i le 28 octobre 2020,0,104
