,comments_text,review,comments_titles,dates,comments_utility,words_number
0," Je viens de recevoir ce fauteuil de travail à roulettes. Un Amazon basique... donc de qualité correcte pour le prix. :)Il est recouvert d'un tissu alvéolé synthétique, très bien cousu, de couleur noire mat; et surtout avec une bonne épaisseur d'une mousse suffisamment ferme pour assurer un bon confort de travail, et avec une assise et un dossier des plus larges; pas comme certains fauteuils 1er prix... L’ensemble présente très bien, et le confort me semble pour le moment satisfaisant, même si je commence seulement à l'utiliser... en postant ce commentaire !Le fauteuil a été très facile à monter, à l'aide de la clé BTR fournie. L'assemblage des différents éléments au moyen de vis M6 et M8 qui vissent dans des inserts métalliques, inspire vraiment confiance. Le pied est en plastique, mais il me parait tout à fait robuste.Par contre, personnellement, j'ai tout de suite équipé mon siège de roulettes en caoutchouc souple achetées séparément; car elles seront beaucoup plus adaptées à mon sol en parquet... bien trop vulnérable avec des roulettes classiques. Je n'ai donc pas monté les roulettes d'origine en plastique dur. Mais leur qualité me semble correcte, au moins visuellement.Le réglage en hauteur du fauteuil est un vrai plaisir; grâce aux mouvements bien fluides du verin.L'inclinaison est, par contre, très basique : Une grosse molette, très dure à tourner... permet néanmoins de faire basculer l'ensemble du siège vers l'arrière; assise comprise ! Ce réglage là est donc très sommaire, et vu sa commodité... on n'y retouchera certainement pas souvent. Mais il à le mérite d'exister, pour si l'on trouve le dossier... trop raide. Mais ce réglage est fixe, pour le prix modeste... le dossier n'a pas d'amortisseurs pneumatiques.Conclusion : C'est un fauteuil de travail robuste, très bien fini, et confortable. A mon avis, il devrait être durable malgré son prix très raisonnable. Ce n'est pas un ""Amazon basique"" pour rien ! ;)EDIT : Au sujet de l'inclinaison du dossier...Je viens de m’apercevoir que j'avais mal apprécié les possibilités de réglage.D'origine, la molette est déjà presque serrée à fond... ce qui rend le dossier, très rigide... comme fixe. Alors qu'une fois la molette largement dévissée, lorsque l'on tire sur la manette principale, cela déverrouille bien un basculement en arrière de tout le siège. Le dossier devient alors enfin SOUPLE ! MAIS, l’inconvénient d'avoir l'assise solidaire du dossier demeure : Il faut pousser sur ses jambes - pas du tout pratique ni naturel... à l'usage - pour déporter tout son poids (centre de gravité) vers l'arrière; ce qui fait alors basculer l'ensemble du  siège, et donc finalement... oui, le dossier !Il ne suffit donc pas d'appuyer son dos sur le dossier... pour qu'il s’incline tout naturellement en arrière, comme avec les fauteuils plus élaborés... certainement plus chers aussi. ",4," Fauteuil de travail basique, mais robuste et confortable; je pense qu'il sera durable ! ",17 août 2017,43,459
1," Livraison  très rapide par Chronopost.Ce fauteuil de bureau est très facile à monter grâce à la notice en français, les huit vis (fournies avec la clé) et les schémas très clairs qui décrivent les étapes.Au final, il présente une forme classique et donne une impression rassurante de solidité.Le tissu - ou plutôt la toile - qui le recouvre semble résistante et les finitions sont bonnes, au-dessus de la moyenne pour ce genre de produit.Mon seul petit regret est l'absence d'un réglage indépendant pour le dossier, même si ce n'est pas très gênant à l'usage car l'angle par défaut entre l'assise et le dossier semble adapté à toutes les morphologies.En outre, le dossier reste souple puisqu'il est possible de basculer en arrière,  l'assise basculant avec le dossier.Cette absence de réglage du dossier par rapport à l'assise n'est sans doute pas très contraignante même si j'aurais préféré avoir cette possibilité. On verra à l'usage.Comme d'autres personnes l'ont fait remarquer, les roues sont très ... roulantes, et c'est un peu gênant sur un sol très lisse (dans mon cas, parquet flottant) car le moindre mouvement a tendance à vous envoyer valser.La solution la plus simple est de placer un tapis sous les roues, ce qui augmente les frottements et rend les mouvements moins aléatoires.J'ai pensé aussi enlever les roues mais le fauteuil se retrouve alors trop bas par rapport au plan de la table, et ne plus pouvoir du tout bouger n'est pas très agréable.Le tapis semble donc être une bonne solution, du moins en ce qui me concerne.Au plan esthétique, bien que la forme soit très classique, le fauteuil a belle apparence, grâce à la qualité de son tissu, aux coutures fines et peu visibles, à sa sobriété et à sa couleur d'un noir profond faite pour se fondre dans n'importe quel intérieur.Bien entendu, je ne peux donner d'appréciation sur la durée mais, a priori, étant donné la qualité des matériaux, je pense qu'il devrait résister à l'usage.Je recommande donc cet achat sans hésiter. ",4, Bonne qualité et assise confortable ,3 avril 2019,18,332
2," J'avais besoin d'une nouvelle chaise pour l'ordinateur, elle a été assez facile et rapide à monter mais... car il y a un mais, je dois appuyer la jambe droite fortement au sol car le siège n'est pas bien horizontal, il penche fortement à droite, je pense que c'est une question de rembourrage qui n'est pas équivalant des deux côtés, donc, irrémédiable.  Et il a tendance à verser un peu sur le devant, je ne parviens pas à le mettre totalement d'équerre.  Cela me fait faire de l'exercice car je dois tout le temps me retenir, il m'est impossible de m'appuyer au dossier, du fait de cette pente qui me fait glisser en avant.  Pas trop confortable, je ne peux pas le recommander pour y être assise pendant toute une journée de travail... ",3, chaise un peu bancale ,16 septembre 2019,13,132
3," J'ai choisi ce siège pour 2 raisons : je n'ai jamais été déçu par un produit AmazonBasics et les avis clients sont assez unanimes.Ce fauteuil est tout d'abord très bien emballé, son mode d'emploi en français est d'une limpidité parfaite et le montage d'une simplicité remarquable, fait en 6 vis et moins de 10 minutes...Suivant des conseils d'autres clients, j'ai remplacé les roues d'origine par 5 roues caoutchoutées car j'ai un parquet vitrifié.Le tissus a un bon aspect résistant, le fauteuil est bien fini et inspire confiance.C'est un fauteuil confortable (j'en ai un usage domestique et non professionnel) réglable en hauteur ainsi qu'en inclinaison du dossier.Je recommande ce produit. ",5, Très satisfait ,28 août 2017,14,109
4," Cette chaise de bureau est inconfortable. Je l'utilise depuis 3 semaines, il n'y a déjà plus de mousse sur le devant de la chaise. toute la mousse est à l'arrière; En plus quand on est assit on à l'impression d'être de travers. Je suis très déçue de mon achat et déconseilles fortement. ",1, Nul ,21 octobre 2021,5,52
5," Montage facile. Bonne épaisseur de l'assise et du dossier, bon soutien. Cela reste du Made in China. Mais pas de défaut majeur. Je pense que c'est un bon achat pour le prix, comparé à d'autres modèles de siège vendus sur Amazon. J'ai longtemps hésité mais je ne regrette pas cet achat. J'ai le sentiment que les prix des sièges de bureau sont un peu surévalués en ce moment ( le télétravail est une aubaine pour certains). En dessous de 80 €, je me dis que ce siège est un bon choix. ",4," Confortable, stable et épais. C'est ce qu'il me fallait. ",11 février 2021,2,91
6," - Ce siège est bancal, mauvaise symétrie des visses.- L'assise est mauvaise, 2-3h par jour sur ce siège et déjà mal au dos...- Pas confortable, les chinois doivent absolument penser aux morphologies européennes différentes des leurs, ce n'est pas la première fois que je rencontre ce problème, SVP faites des produits adaptés, plus large, plus grand, plus confortable...pas seulement des produits pour faire des produits. ",1, Mauvais produit ,26 octobre 2021,2,65
7, Le produit est très confortable et facile à monter. L'assise est robuste et si sent bien même après de longues séance de travail. Je recommande ce fauteuil ! ,5, Un très bon fauteuil de bureau ,6 octobre 2019,6,28
8," Cette chaise de bureau est vraiment très agréable; non seulement elle est très facile à monter avec un plan et un mode d'emplois très simple .Les réglages de la hauteur et de l'inclinaison du dossier se font très facilement .Elle est très confortable, après plusieurs heures passées devant l'écran , on ne sent aucune fatigue . ",5, Vraiment très agréable ,13 juin 2017,10,56
9," Je viens de finir a monter le fauteuil mais ce dernier qui est supposé remplir les capacités de s'asseoir et rouler ne fonctionne pas correctement. 3 roulettes sur 5 ne glisse pas comme il le faudrait. Heureusement que j'ai pu récupérer celles de mon ancien fauteuil pour les installer sur ce nouveau...Vous imaginé, devoir retourné mon article juste pour ça...J'imaginais Amazon Basic comme des articles standard sans superflu mais de bonne qualité, içi ce n'est pas le cas. ",2, Fonctionnel a moitié ,16 juillet 2021,0,78
10," La mousse sur le dossier est bien ferme contrairement à celle de l'assise qui se tasse avec le poids du corps mais elle remonte bien lorsque l'on quitte la chaise.Je mesure 188 cm et l'assise est courte pour les jambes.Je l'utilise en télétravail  depuis 2 jours , et je peux vous dire que l'on ne risque pas de s'endormir dessus. ",3, Bon maintien du dos ,29 janvier 2021,0,60
11," le siege pass en position basse, le verin est cassé, ce qui est enervant est que il peut repasser en position haute et apres un moment, le siege descent tout seul quand n est assis dessusje souhate juste un nouveau verrin a 18€ mais Amazon ne le propose pas en remplacement ",1, le verin est cassé apres 1 semaine d'uilisation ,1 février 2022,0,51
12," Je l'utilise avantageusement pour me placer devant mon écran d'ordinateur.Les dessins techniques détaillés de la notice de montage et la clé mâle à pans de bon aloi (fournie), facilitent grandement le montage du fauteuil de bureau. La hauteur d'assise de ce fauteuil , une fois monté, pouvant être réglée de 88 cm à 96 cm permet d'atteindre la hauteur désirée des yeux face à l'écran.Un seul bémol : la livraison qu'il faut suivre. ",4," Fauteuil de bureau pivotant, à 5 pieds à roulette. Siège et dossier mi-dos, rembourrés. ",7 novembre 2020,0,73
13," Excellente qualité, montage très facile, documentation complète en plusieurs languesAvec tous les accessoires (clé, vis)Toutes les pièces sont bien emballées et protégéesLe piston du centre est protégé par des tubes télescopiquesAmazonBasics est vraiment très bien et le prix exceptionnel !! ",5, FAUTEUILS AMAZON ,16 mai 2019,0,40
14, Beau design( c'est perso) de construction classique. Apres deux mois d'utilisation satisfait de la qualité du verin et du revetement qui est agréable. En revanche un peu décu par la qualité de la mousse d'assise qui a tendance a s'affaisser lors d'une utilisation de plus d'une heure d'affillé ( poids de 85kg) ,3, Bonne chaise pour une utilisation de duree limitee ,10 mars 2022,0,52
15," J'ai acheté cette chaise en fonction des notes et des commentaires positifs et parce qu'elle était proposée par Amazon. les réglages sont insuffisants (uniquement hauteur et molette de tension du ressort d'inclinaison). . Malheureusement, cette chaise m'est inadaptée. Je suppose que les commentaires positifs sur le confort sont liés à l'épaisseur inhabituelle de mousse pour l'assise et le dossier. A voir en fonction de vos goûts. Les roulettes accrochent. ",2, A réserver pour ceux qui n'ont pas mal au dos (réglages insuffisants). ,7 août 2020,0,69
16," Facile à monter mais il grince un peu, le réglage de l'inclinaison est mal placé et très difficile. Mais le pire au bout d'une heure là mousse est plate car elle n'est pas assez dense... Donc pas confortable pour de longues session informatique... Cela dit elle reprend sa forme après coup. Bien pour une utilisation de courte durée. ",3, Pour utilisation ponctuelle ,29 août 2019,4,58
17," acheté 2 , une pour chacun ... très bien, faciles à monter, confortables , adoptées immédiatement , plusieurs heures devant l'ordi et on oublie enfin nos lombaires, c'est cool ",4, bien ,7 septembre 2017,4,29
18," Normalement une bonne chaise est conçue pour s'assoir tous les jours dessus et ce pendant des années !A priori celle-ci non !L'assise s'est affaissée du côté gauche et pourtant je ne suis pas plus lourd d'un côté que de l'autre et je ne m'assois pas non plus plus d'un côté que de l'autre et surtout ... que quelques heures par mois.Je pèse 70kgs donc ""misère  à très court terme"" pour des personnes ""plus lourdes"" !Problème de mousse ponctuel ?Amazon peut mieux faire et même hors ""garantie"" un remplacement serait le bienvenu :-) ",2, pas terrible !!! ,9 mai 2021,0,92
19," Aussitôt reçue, aussitôt montée en un tour de main.  Assise large et un peu incurvée permettant un bon confort. Il fautbien s'assoir au fond du siège pour bénéficier du dossier qui maintien bien le dos (nécessaire lorsque l'on passe du temps devant l'ordinateur). J'ai du carrelage au sol donc les roulettes ne ""s'emballent"" pas ce qui permet de s'assoir en tout sécurité. Dommage qu'il ne se fasse qu'en noir mais je recommande ce siège. ",5, Belle et bonne assise ,24 janvier 2020,0,74
20," La chaise est assez comfortable, mais il faut mettre quelque chose dessus, car son tissu est assez horrible. (J'avais lu des commentaires sur cet aspect, donc je ne le considère pas dans l'évaluation).On le partage entre plusieurs collègues, de taille et poids très différents. C'est ok sans plus, mais pour tout le monde. ",5," Bonne chaise, ok pour le prix ",27 octobre 2019,0,53
21," Cette chaise de bureau est parfaite!!! Elle est confortable, elle est jolie et sobre, elle se monte et se règle très simplement. Elle est solide. Je pèse un poids certain donc un certain poids au dessus du quintal et elle me supporte. Maintenant on verra dans le temps? Mais je recommande à tous cet article!!! ",5, Excellente chaise !!! ,8 septembre 2021,0,55
22," J'apprécie l'assise de cette chaise de bureau. L'accueil est très agréable, le rembourrage de l'assise est top, et le dossier ne nous pose pas de problème. Bon rapport qualité/prix pour cet article et livraison au top, comme Amazon nous y a habitué ",5, Très bonne chaise de bureau ,11 janvier 2022,0,42
23," Assise épaisse, pas d'info sur la densité de la mousse, a voir combien de temps avant qu'elle ne soit toute aplatie. Parcontre les roues sont vraiment nulles, c'est simple elles ne tournent pas toutes et risque de rayer le parquet. ",3, Bonne chaise ,20 août 2021,0,40
24, Chaise confortable si on peut s'assoir correctement ce qui n'est pas mon cas car beaucoup trop haute et moi trop petite. Apparemment bien rembourrée et solideDéçue de mon achatCompte tenu du poids je ne peux la retourner. Dommage mais rien à dire. ,5, Idéale pour le bureau ,17 novembre 2020,0,42
25," Très belle chaise de bureau et confortable, la hauteur de l'assise varie de 44 à 54 cm, le tissu est agréable et la structure parait solide. Bien-sur le basculement est débrayable.J'aurais aimé pouvoir choisir le style des roulettes (pour moquette d'origine).Cinq étoiles en qualité/prix car achetée en promotion de 20 %.Content de cet achat ! ",5, Bonne qualité de fabrication. ,31 octobre 2020,0,55
26," Très bonne chaise, bon rapport qualité/prix, facile à monter. J'ai du la rendre poisque elle n'était pas bien adapté au dos d'une adolescente. Pour info de tout le monde, dans les instructions on specifie bien que les roulettes sont adapté à la moquette, rien d'autre ",5, très confortable ,11 décembre 2018,2,45
27," Bonne qualité de fabrication, acheté en promotion c'est une bonne affaire pour de petite période de travail.Montage facile mais alignement du dossier un peut difficile.très confortable ",5, Bon rapport qualité prix ,1 juillet 2021,0,26
28, Fauteuil confortable et de bonne qualité : les coussins sont épais et le dossier bas soutient bien le dos. Je le recommande pour les personnes qui passent beaucoup de temps au bureau. ,5, Fauteuil confortable et de bonne qualité ,27 octobre 2019,0,32
29," Je suis heureux de mon achat (auparavant j’utilisais un tabouret légèrement rembourré);désormais c’est confortable.Le montage est simplisme.Pour le moment, je suis très satisfait de mon achat. ",4, CONFORTABLE ,1 août 2021,0,26
30," Je m'en sers pour la couture. Parfait.  Facile à monter. Roule très bien.Acheté en reconditionné, bien moins cher. Je cherche encore où sont les défauts 😂Je recommande sans hésiter ! ",5, Parfait ! ,23 août 2021,0,30
31," Il correspond parfaitement à mes attentes, livraison ultra rapide, très rapide et facile à monter, la qualité est très bonne et il répond parfaitement à mon besoin (fauteuil pas trop grand/large, sans accoudoir, qui glisse sous le bureau, en tissu et confortable). Merci Amazon! ",5, Il est top!!! ,7 août 2019,0,44
32," J'ai été attiré par une promo cet été et je ne regrette pas.Montage standard, tissus plutôt épais (et facile à nettoyer), confort normal.Mes enfants sont ravis. ",5, Une bonne chaise dactylo pour un usage raisonnable ,7 décembre 2019,0,26
33," Ça fait plus d'un mois que j'utilise ce produit et j'en suis bien contente. Elle est confortable et ne prend pas beaucoup de place. J'ai un parquet blanc de très bas gamme, mais je n'ai aucun souci avec ses roulettes, ne laissent même pas des trace ",5, Très bon achat ,11 avril 2021,0,46
34, Chaise très confortable solide car je monte dessus des fois 🤣Ce que j'apprécie spécialement c'est qu'il n'y a pas d'accoudoir donc elle rentre sous le bureau ,5, Chaise solide ,14 mars 2022,0,26
35," Reçu légèrement déchiré au niveau du dossier, l'assise est en mousse certes épaisse, mais qui tient rapidement chaud. Le dossier bas en non réglable en maille 3D très fragile, reçu abîmé, est trop incliné et trop en arrière. Ne vaut pas plus de 50-60€. ",3, vraiment basique ,21 juin 2021,0,44
36," très déçue Il manque les vis et clefs pour le montage. Handicapée, il m'est impossible de retourner un tel colis. Que puis je faire ?Désolée, mais je viens de retrouver les vis tout au fond du carton. Je vous présente mes excuses. Produit tout à fait conforme. merci. ",1, manque vis et clé. Eléments retrouvés ! ,3 juin 2021,0,48
37," La basculement dossier assise n'est pas agréable donc on ne s'en sert pas...dommage.Quant aux roulettes... de mauvaise qualité, j'ai du les changer ",3, Bof... ,30 novembre 2021,0,22
38," Très facile à monter, nous le trouvons confortable! Il se glisse sous un petit bureau facilement, il est sobre... ma fille de 13 ans en est fan!En revanche, attention, ce n'est pas un fauteuil de gamer ni une chaise dactylo pro...  pour un usage modéré, il est d'un excellent rapport qualité / prix! ",5, Rempli son job! ,28 février 2020,0,53
39," Chaise vraiment confortable, très roulante, attention quand on s’assoit 😉 facile à monter. Système de réglage fonctionne bien. ",5, Confort ! ,18 mars 2021,0,18
40," C'est un fauteuil de bonne qualité apparente, peu encombrant, très facile à monter la clé étant incluse dans le lot d'accessoires. ",5, un bon fauteuil ,21 novembre 2019,0,21
41, commandé d'occasion sur Warehouse dans un état soi disant neuf ; en réalité paquet ouvert; la moitié des vis manquantes ; amazon a fait un geste commercial donc ça va ; c'est une chaise à la fois confortable et ergonomique (soutien lombaires ok) ; peu encombrante ; qualité ok (à voir dans le temps) ; simple à monter (si on a les vis ...) ,4, confortable et ergonomique ,6 août 2021,0,64
42, Assise épaisse et très confortable.Reçu avec un petit trou dans le tissu ajouré sur la tranche de l'assise d'où 4 étoiles ! ,4, Bon fauteuil ,5 août 2021,0,22
43, Est très confortable et facile a monter. Prix très intéressant. A voir dans la durée pour la solidité ! ,5, très confortable ,26 octobre 2019,0,19
44," Pour un petit coin bureau dans le salon, je voulais une chaise discrète, voilà pour le premier point. Cette chaise est confortable avec un dossier bien rembourré qui maintient bien le dos. Le montage est hyper facile avec la notice détaillée et l'outil fourni. ",4, Confortable ,22 août 2021,0,44
45," facile à monter, par contre la mousse s'est affaissée au bout d'une semaine pourant je ne suis pas lourd! ",2, Problème de mousse ,8 août 2021,0,19
46, bien recus tres satisfaite de mon achat facile a monter solide confortable tres bon rapport qualite prix merci amazon ,5, top ,20 mai 2020,0,19
47,                         Le produit multimédia n'a pas pu être chargé.                      Facile à monter et confortable. Semble robuste et look sympa. ,5, Très bon rapport qualité prix ,30 juin 2021,0,18
48, Pas confortable du tout le tissu sans mauvais et gratte . Le montage j’ai eu 2 vis du dossier ou j’ai du forcer pour les visser à fond . Vraiment déçu d cette achat . Je le déconseille ,2, Déçu ,4 août 2019,0,38
49, Vraiment pas déçu. Fauteuil de qualité et très confortable en rapport du prix. ,5, Rapport qualité prix excellent. ,19 mai 2022,0,13
50," J'ai acheté cette chaise pour faire le télétravail, mais vu que je suis informaticirn je passe 14h sur cette chaise, qui devient inconfortable au bout de quelques heures. La mousse s'aplatit d'où l'inconfort. Je vais la donner à mon fils qui est plus léger. ",3, Pas très confortable. ,29 mars 2021,0,44
51," très bien (au regard de son prix) pour une utilisation occasionnelle,  par contre au bout de plusieurs heures la mousse se taffe et le fauteuil devient moins confortable. De mon point de vue : pour 2 h parfait, pour une journée de travail : un peu limite. ",3, confort limité sur la durée ,21 octobre 2020,0,47
52," Chaise bureau trés correcte et trés solide, pas faites pour etre assis pendant 7 h dessus, pour ma part j ai mis de meilleur roulette a part ça pour son utilité occasionnel ça va. ",5, Chaise robuste ,8 juin 2020,0,34
53," Bon rapport qualité prix. Confortable, réglable, Top ! ",5, Confortable ,8 septembre 2020,0,8
54," Etonné de voir qu'après seulement 5H d'utilisation je sens deja la structure de la chaise au niveau de l'assise, alors que je pese seulement 75Kg. La densité de la mousse d'assise est inexistante j'ai l'impression d'être assis sur une planche. Très déçu en comparaison de produit ""suedois"" au même prix. ",1, Mousse d'assise inexistante après quelques jours ,7 novembre 2020,0,50
55," J'ai été surprise par la qualité de l'explication pour le montage. Impossible de se tromper si l'on regarde ""bien"". La clé est fourni.De plus 2 vis sont offertes au cas où !Dommage le tissu de l'assise est un peu rêche. (il vaut mieux avoir un pantalon) ",5," confort, simplicité de montage; ",20 juillet 2017,3,46
56, Deux roulettes ne fonctionnent pas ,2, Chaise fonctionnelle ,8 juillet 2021,0,5
57," bonjour ,je l' ai acheter depuis 2 mois environ ,et j' en suis contente  et je regrette pas mon achat ",5, chaise Fauteuil de bureau ,20 novembre 2019,0,20
58, bonne qualité très bien et confortable ,5, PARFAIT ,24 avril 2022,0,6
59, Facile à monter et d'un grand confort. ,4, Excellent produit ,7 août 2021,0,7
60," Fauteuil confortable et de bonne qualitéCependant si utilisation sur sol carrelé prendre les roulettes adaptées (+24,99€) ",5, Satisfaite de mon achat ,15 août 2020,0,16
61, Bien rembourré. Bonne estethique. ,5, Bon rapport qualité prix ,29 décembre 2019,0,4
62," on en a pour son argent, pas plus pas moins ",3, qualité moyenne ,5 décembre 2019,0,10
63, Ras ,5, Ras ,13 novembre 2021,0,1
64, très solide bien épais tissu alvéolé de qualité ! facile a monter pas cher livraison en mois de 48 hwhat else ???? ,5, vraiment parfait ! ,19 octobre 2021,0,22
65, Surpris du rapport qualité prix ! Je recommande ! ,4, Excellent rapport qualité prix ,3 juin 2021,0,9
66, Bien ,4, Bien ,20 décembre 2021,0,1
67, Superbe assise pour cette chaise de bureauFacile à monterLivraison ultra rapide ,5, Au top ,4 juin 2019,0,11
68, Très bon produit je recommande pour son côté confort esthétique et prix ,5, Très bon achat confortable et cossu ,6 juillet 2019,0,12
69," j'ai acheté ce chaise de bureau ; RAS, la qualté es au delà de mes attents . je la recommande vivement ",5, une chaise de bureau très confortable ,26 janvier 2021,0,21
70, Un peu basse mais confortable ,5, Confort ,13 juillet 2020,0,5
71, Excellent produit : bonne tenue du dos et assise très confortableLes roulettes achetées en même temps : aucun regret non plus : souples et aucun bruit de déplacement.Bon produit ,5, Confortable : Assise et Dossier ,4 janvier 2020,0,29
72," Montage facile, et c'est confortable. Un peu plus cher que d'autres modèles que j'ai pu voir, mais ça a l'air solide.Edit : un mois plus tard, la mousse du siège est complètement tassée. Déçu mais pas surpris. ",4, Fait ce qu'on lui demande ,27 octobre 2020,0,37
73," sans doute pour un choix plus judicieux, proposer les deux versions de ""roulettes"" pour ne pas se retrouver avec un jeu de roulettes inutile et inutilisé ",4, le type de roulettes ainsi que le rembourage du siège et du dossier ,30 août 2021,0,26
